Repository,Owner,URL,Stars,Forks,Watchers,Last Commit Date,Main Language,License,Size (KB),Main Branch,Topics,Issues,Pull Requests
reactjs-interview-questions,sudheerj,https://github.com/sudheerj/reactjs-interview-questions,42887,10057,0,2025-08-21T16:06:18Z,JavaScript,MIT License,4236,master,"reactjs, react-router, redux, javascript, javascript-framework, react-native, interview-questions, interview-preparation, react, react-interview-questions, javascript-interview-questions, react16, javascript-applications",110,253
whisper.cpp,ggml-org,https://github.com/ggml-org/whisper.cpp,42820,4627,0,2025-08-24T16:34:23Z,C++,MIT License,26117,master,"openai, speech-to-text, transformer, whisper, inference, speech-recognition",1756,1129
expo,expo,https://github.com/expo/expo,42775,8272,0,2025-08-30T20:56:21Z,TypeScript,MIT License,3426183,main,"mobile, expo, native, web, universal, react, android, ios, app-framework, web-framework, native-apps, javascript, framework, frontend, react-native, typescript",17037,20831
MinerU,opendatalab,https://github.com/opendatalab/MinerU,42766,3514,0,2025-08-29T10:36:18Z,Python,GNU Affero General Public License v3.0,135010,master,"extract-data, layout-analysis, ocr, parser, pdf, pdf-converter, python, document-analysis, pdf-parser, pdf-extractor-llm, pdf-extractor-pretrain, pdf-extractor-rag, ai4science",1696,1157
nvm-windows,coreybutler,https://github.com/coreybutler/nvm-windows,42610,3594,0,2025-03-31T10:37:07Z,Go,MIT License,33300,master,"node, versioning, management, version-manager, windows, nodejs, version, nvm, go, switch, node-version-manager",928,201
ClickHouse,ClickHouse,https://github.com/ClickHouse/ClickHouse,42601,7600,0,2025-08-30T22:21:21Z,C++,Apache License 2.0,2267326,master,"dbms, olap, analytics, sql, big-data, mpp, clickhouse, hacktoberfest, cpp, rust, ai, cloud-native, database, distributed, embedded, lakehouse, self-hosted",25103,60392
Made-With-ML,GokuMohandas,https://github.com/GokuMohandas/Made-With-ML,42550,6626,0,2024-08-18T04:34:15Z,Jupyter Notebook,MIT License,4001,main,"machine-learning, deep-learning, pytorch, natural-language-processing, data-science, python, mlops, data-engineering, data-quality, distributed-ml, llms, ray, distributed-training",74,193
pm2,Unitech,https://github.com/Unitech/pm2,42497,2654,0,2025-08-29T12:54:19Z,JavaScript,Other,13500,master,"pm2, nodejs, node, process-manager, monitoring, load-balancer, production, deploy, command-line, command-line-tool",5083,917
git-flight-rules,k88hudson,https://github.com/k88hudson/git-flight-rules,42432,3209,0,2025-04-11T22:26:43Z,Not specified,Creative Commons Attribution Share Alike 4.0 International,1009,master,,73,292
TTS,coqui-ai,https://github.com/coqui-ai/TTS,42335,5545,0,2024-08-16T12:07:14Z,Python,Mozilla Public License 2.0,170196,dev,"python, text-to-speech, deep-learning, speech, pytorch, tts, vocoder, tacotron, glow-tts, melgan, speaker-encoder, hifigan, speaker-encodings, multi-speaker-tts, tts-model, speech-synthesis, voice-cloning, voice-synthesis, voice-conversion",1191,761
what-happens-when,alex,https://github.com/alex/what-happens-when,42234,5720,0,2024-08-19T13:02:25Z,Not specified,No license,260,master,,293,2209
ruff,astral-sh,https://github.com/astral-sh/ruff,42094,1508,0,2025-08-30T17:55:23Z,Rust,MIT License,92913,main,"linter, pep8, python, python3, rust, rustpython, static-analysis, static-code-analysis, style-guide, styleguide, ruff",7160,12376
Alamofire,Alamofire,https://github.com/Alamofire/Alamofire,42070,7638,0,2025-08-30T19:05:45Z,Swift,MIT License,39077,master,"networking, urlsession, urlrequest, httpurlresponse, request, response, swift, xcode, certificate-pinning, public-key-pinning, parameter-encoding, alamofire, cocoapods, carthage, swift-package-manager",2801,1127
python-patterns,faif,https://github.com/faif/python-patterns,42012,7035,0,2025-07-19T00:16:40Z,Python,No license,3800,master,"python, idioms, design-patterns",94,346
chinese-independent-developer,1c7,https://github.com/1c7/chinese-independent-developer,41957,3497,0,2025-08-29T04:28:52Z,Not specified,No license,3214,master,"indie, indie-developer, china",204,355
CPlusPlusThings,Light-City,https://github.com/Light-City/CPlusPlusThings,41908,8781,0,2024-06-14T01:58:36Z,C++,No license,1322,master,"cplusplus, cpp, cpp11, cpp14",228,123
sentry,getsentry,https://github.com/getsentry/sentry,41855,4415,0,2025-08-30T02:08:25Z,Python,Other,709129,master,"crash-reporting, crash-reports, error-monitoring, monitoring, devops, csp-report, django, error-logging, sentry, python, monitor, apm, hacktoberfest, tag-production, fair-source",15779,81307
Pake,tw93,https://github.com/tw93/Pake,41839,7774,0,2025-08-29T11:02:24Z,JavaScript,MIT License,51842,main,"rust, tauri, no-electron, linux-desktop, mac, mac-desktop, windows-desktop, high-performance, productivity, chatgpt, twitter, youtube, openai, music, programming, excalidraw, gemini, deepseek, gemini-ai, llm",406,190
airflow,apache,https://github.com/apache/airflow,41796,15501,0,2025-08-30T19:18:06Z,Python,Apache License 2.0,434917,main,"airflow, apache, apache-airflow, python, scheduler, workflow, automation, dag, data-engineering, data-integration, data-orchestrator, data-pipelines, data-science, elt, etl, machine-learning, mlops, orchestration, workflow-engine, workflow-orchestration",12508,37320
spark,apache,https://github.com/apache/spark,41792,28759,0,2025-08-30T20:15:11Z,Scala,Apache License 2.0,513812,master,"python, scala, r, java, big-data, jdbc, sql, spark",0,52140
EasySpider,NaiboWang,https://github.com/NaiboWang/EasySpider,41788,5141,0,2025-08-23T09:58:05Z,JavaScript,GNU Affero General Public License v3.0,146937,master,"code-free, crawler, gui, layman, spider, parameters, web, www, input-parameters, frontend, html, batch-processing, batch-script, visual, visualization, visualprogramming, scraper, data-collection, rpa, robotics",715,72
cobra,spf13,https://github.com/spf13/cobra,41733,2986,0,2025-08-11T13:58:23Z,Go,Apache License 2.0,1949,main,"cobra, cobra-library, cobra-generator, posix-compliant-flags, command-cobra, cli-app, command-line, commandline, command, cli, go, golang, golang-library, golang-application, subcommands, posix",1213,1073
iina,iina,https://github.com/iina/iina,41721,2672,0,2025-08-16T21:50:55Z,Swift,GNU General Public License v3.0,276982,develop,"macos, video-player, swift, video, mpv, hacktoberfest",4191,1249
freqtrade,freqtrade,https://github.com/freqtrade/freqtrade,41714,8492,0,2025-08-30T18:08:10Z,Python,GNU General Public License v3.0,624407,develop,"python, cryptocurrencies, trading-bot, telegram-bot, bitcoin, trade, cryptocurrency, algorithmic-trading, freqtrade",5343,6754
kong,Kong,https://github.com/Kong/kong,41639,4968,0,2025-08-26T04:11:07Z,Lua,Apache License 2.0,95322,master,"api-gateway, nginx, luajit, microservices, api-management, serverless, apis, reverse-proxy, cloud-native, microservice, devops, kubernetes, kubernetes-ingress-controller, kubernetes-ingress, ai, artificial-intelligence, ai-gateway, llm-gateway, openai-proxy, llm-ops",4560,8720
stablediffusion,Stability-AI,https://github.com/Stability-AI/stablediffusion,41638,5314,0,2025-06-25T14:18:37Z,Python,MIT License,75202,main,,324,99
yarn,yarnpkg,https://github.com/yarnpkg/yarn,41559,2734,0,2025-08-27T18:03:04Z,JavaScript,Other,119772,master,"yarn, npm, package-manager, javascript",6607,2369
GitHubDaily,GitHubDaily,https://github.com/GitHubDaily/GitHubDaily,41558,4217,0,2025-03-20T08:54:47Z,Not specified,No license,2839,master,"github, open-source, ai, java, python, web, javascript, frontend, backend, developer-tools, tutorials, algorithms-and-data-structures, markdown, linux, development, kubernetes",586,23
tldraw,tldraw,https://github.com/tldraw/tldraw,41498,2676,0,2025-08-30T17:51:02Z,TypeScript,Other,871557,main,"drawing, sketch, whiteboard, canvas, diagram, infinite, react, collaboration, design, multiplayer, sync, sdk",1752,4205
diagrams,mingrammer,https://github.com/mingrammer/diagrams,41394,2661,0,2025-08-28T03:05:13Z,Python,MIT License,61784,master,"diagram, diagram-as-code, architecture, graphviz",533,591
swiper,nolimits4web,https://github.com/nolimits4web/swiper,41361,9740,0,2025-08-13T22:34:49Z,JavaScript,MIT License,83801,master,"swipe, swiper, gallery, touch, touch-events, mobile, slider, carousel",5753,888
ailearning,apachecn,https://github.com/apachecn/ailearning,41333,11581,0,2024-11-12T16:21:55Z,Python,Other,171378,master,"fp-growth, apriori, mahchine-leaning, naivebayes, svm, adaboost, kmeans, svd, pca, logistic, regression, recommendedsystem, sklearn, scikit-learn, nlp, deeplearning, python, dnn, lstm, rnn",115,533
bevy,bevyengine,https://github.com/bevyengine/bevy,41277,4077,0,2025-08-29T22:59:28Z,Rust,Apache License 2.0,147982,main,"bevy, gamedev, game-engine, open-source, rust, game-development",7240,11692
dubbo,apache,https://github.com/apache/dubbo,41272,26534,0,2025-08-26T07:14:27Z,Java,Apache License 2.0,60636,3.3,"dubbo, distributed-systems, framework, java, microservices, restful, rpc, grpc, http, service-mesh, web",7277,8037
streamlit,streamlit,https://github.com/streamlit/streamlit,41157,3684,0,2025-08-30T20:53:48Z,Python,Apache License 2.0,718018,develop,"python, machine-learning, data-science, deep-learning, data-visualization, streamlit, data-analysis, developer-tools",5434,6827
vue2-elm,bailicangdu,https://github.com/bailicangdu/vue2-elm,41155,12378,0,2025-04-11T12:52:02Z,Vue,GNU General Public License v2.0,34425,master,"vue, vuex, webpack, es2015, vue-router, sass, flex",630,50
jsoncrack.com,AykutSarac,https://github.com/AykutSarac/jsoncrack.com,41152,2927,0,2025-08-22T17:58:28Z,TypeScript,Apache License 2.0,41047,main,"json, tool, react, visualization, graph, nextjs, diagrams, csv, yaml",269,173
ColossalAI,hpcaitech,https://github.com/hpcaitech/ColossalAI,41121,4526,0,2025-08-26T13:51:16Z,Python,Apache License 2.0,66378,main,"deep-learning, hpc, large-scale, data-parallelism, pipeline-parallelism, model-parallelism, ai, big-model, distributed-computing, inference, heterogeneous-training, foundation-models",1727,4395
ChatGLM-6B,zai-org,https://github.com/zai-org/ChatGLM-6B,41108,5212,0,2024-06-27T04:05:25Z,Python,Apache License 2.0,9362,main,,1309,121
spotube,KRTirtho,https://github.com/KRTirtho/spotube,41084,1763,0,2025-08-30T18:45:37Z,Dart,Other,142399,master,"youtube, desktop-client, music-player, music, flutter, flutter-desktop, windows, linux, macos, android, android-client, fdroid, android-music-player",1865,387
nw.js,nwjs,https://github.com/nwjs/nw.js,41076,3883,0,2025-08-29T16:36:07Z,JavaScript,MIT License,134201,main,"web-application-framework, javascript, desktop, node-webkit, nwjs, nodejs",7400,844
uni-app,dcloudio,https://github.com/dcloudio/uni-app,41075,3703,0,2025-08-29T09:50:15Z,JavaScript,Apache License 2.0,6893761,next,"uni-app, vue, miniprogram, javascript, uniapp, uni, hbuilderx, vue3, android, cross-platform, crossplatform, ios",4928,675
awesome-compose,docker,https://github.com/docker/awesome-compose,41064,7645,0,2025-07-22T05:26:19Z,HTML,Creative Commons Zero v1.0 Universal,8282,master,"awesome-list, awesome, docker-compose",129,453
styled-components,styled-components,https://github.com/styled-components/styled-components,40895,2517,0,2025-06-18T19:28:46Z,TypeScript,MIT License,34603,main,"react, css-in-js, styled-components, css",2953,1344
black,psf,https://github.com/psf/black,40872,2615,0,2025-08-25T10:19:06Z,Python,MIT License,7315,main,"python, code, formatter, codeformatter, gofmt, yapf, autopep8, pre-commit-hook, hacktoberfest",2725,1951
zig,ziglang,https://github.com/ziglang/zig,40779,2977,0,2025-08-30T22:04:32Z,Zig,MIT License,367583,master,"compiler, zig, language",13182,11788
vuetify,vuetifyjs,https://github.com/vuetifyjs/vuetify,40707,7071,0,2025-08-30T22:34:09Z,TypeScript,MIT License,96876,master,"vue, vuejs, vue-components, material-design, material, material-theme, material-components, javascript, semantic, vue-material, vuetify, vuetifyjs, ui, ui-components, ui-kit, typescript, vuejs3, ui-design, ui-library",14924,6000
TrafficMonitor,zhongyang219,https://github.com/zhongyang219/TrafficMonitor,40706,3487,0,2025-08-21T11:07:54Z,C++,Other,16306,master,,1889,98
hexo,hexojs,https://github.com/hexojs/hexo,40698,4977,0,2025-08-16T00:51:53Z,TypeScript,MIT License,7032,master,"hexo, javascript, nodejs, static-site-generator, typescript",3985,1317
Summer2026-Internships,SimplifyJobs,https://github.com/SimplifyJobs/Summer2026-Internships,40591,3020,0,2025-08-30T23:38:17Z,Not specified,No license,463043,dev,"interview-preparation, internships, jobs, university",3974,1953
cli,cli,https://github.com/cli/cli,40482,6995,0,2025-08-30T01:14:52Z,Go,MIT License,49338,trunk,"github-api-v4, cli, git, golang",5159,3503
fastlane,fastlane,https://github.com/fastlane/fastlane,40451,5930,0,2025-08-07T21:19:55Z,Ruby,MIT License,82013,master,"fastlane, automation, screenshots, ios, android, apps, deployment, mobile, ruby, hacktoberfest, hacktoberfest2021",13188,7601
fanqiang,bannedbook,https://github.com/bannedbook/fanqiang,40353,7381,0,2025-08-30T08:46:54Z,Kotlin,No license,751917,master,"ssr, v2ray, shadowsocks, fanqiang, proxy, goflyway, daze, brook, lightsocks, trojan, psiphon",796,13
mitmproxy,mitmproxy,https://github.com/mitmproxy/mitmproxy,40325,4284,0,2025-08-30T19:55:59Z,Python,MIT License,67182,main,"python, security, man-in-the-middle, tls, ssl, http, http2, websocket, proxy, debugging, mitmproxy",3563,3262
cheat.sh,chubin,https://github.com/chubin/cheat.sh,40095,1862,0,2025-08-08T05:15:06Z,Python,MIT License,4713,master,"cheatsheet, curl, terminal, command-line, cli, examples, documentation, help, tldr, hacktoberfest2021",258,162
pure-bash-bible,dylanaraps,https://github.com/dylanaraps/pure-bash-bible,40053,3565,0,2023-11-28T03:26:23Z,Shell,MIT License,232,master,"bash, shell, script, guide, list, bible, book, reference, handbook, learning, how-to, shell-scripts",77,61
penpot,penpot,https://github.com/penpot/penpot,40035,2172,0,2025-08-29T22:05:27Z,Clojure,Mozilla Public License 2.0,277197,develop,"ux-design, ux-experience, prototyping, clojure, clojurescript, ui, design",1925,5007
tabler,tabler,https://github.com/tabler/tabler,39988,4243,0,2025-08-28T21:34:15Z,HTML,MIT License,362780,dev,"dashboard, html, bootstrap, sass, scss, boilerplate-template, admin-dashboard, dashboard-templates, modular, dashboards, themes, jekyll, css, adminpanel, bootstrap4-theme, uikit, ui-kit, bootstrap5, sponsors, html5",1091,1116
WeChatMsg,LC044,https://github.com/LC044/WeChatMsg,39939,4436,0,2025-04-26T17:26:17Z,Not specified,No license,0,master,"wechat, pyqt, chatgpt, llms",0,91
DeepSpeed,deepspeedai,https://github.com/deepspeedai/DeepSpeed,39913,4531,0,2025-08-30T23:31:27Z,Python,Apache License 2.0,232116,master,"deep-learning, pytorch, gpu, machine-learning, billion-parameters, data-parallelism, model-parallelism, inference, pipeline-parallelism, compression, mixture-of-experts, trillion-parameters, zero",3184,3417
AI-For-Beginners,microsoft,https://github.com/microsoft/AI-For-Beginners,39885,7780,0,2025-08-30T19:32:25Z,Jupyter Notebook,MIT License,923494,main,"deep-learning, artificial-intelligence, machine-learning, ai, computer-vision, nlp, cnn, rnn, gan, microsoft-for-beginners",134,333
zod,colinhacks,https://github.com/colinhacks/zod,39774,1586,0,2025-08-28T18:37:40Z,TypeScript,MIT License,22806,main,"typescript, schema-validation, type-inference, runtime-validation, static-types",2732,1338
helix,helix-editor,https://github.com/helix-editor/helix,39691,3023,0,2025-08-30T17:46:08Z,Rust,Mozilla Public License 2.0,70333,master,"text-editor, vim, rust, kakoune",5400,5885
gradio,gradio-app,https://github.com/gradio-app/gradio,39679,3039,0,2025-08-30T06:58:39Z,Python,Apache License 2.0,303485,main,"machine-learning, models, ui, ui-components, interface, python, data-science, data-visualization, deep-learning, data-analysis, gradio, gradio-interface, python-notebook, deploy, hacktoberfest",5957,5432
ai-hedge-fund,virattt,https://github.com/virattt/ai-hedge-fund,39657,6996,0,2025-08-27T15:42:14Z,Python,No license,2426,main,,221,202
50projects50days,bradtraversy,https://github.com/bradtraversy/50projects50days,39648,9621,0,2025-02-26T13:49:39Z,CSS,MIT License,482,master,,0,215
awesome-remote-job,lukasz-madon,https://github.com/lukasz-madon/awesome-remote-job,39629,4255,0,2025-07-30T18:42:16Z,Not specified,No license,980,master,"awesome-list, awesome, list",80,873
legado,gedoor,https://github.com/gedoor/legado,39619,4565,0,2025-08-27T12:43:27Z,Kotlin,GNU General Public License v3.0,76922,master,,2977,1615
chakra-ui,chakra-ui,https://github.com/chakra-ui/chakra-ui,39612,3469,0,2025-08-29T14:00:00Z,TypeScript,MIT License,278110,main,"chakra-ui, react, uikit, react-components, accessible, a11y, wai-aria, reactjs, dark-mode, ui-components, ui-library, ark-ui, design-system, component, styled, css-in-js",4154,3872
slidev,slidevjs,https://github.com/slidevjs/slidev,39588,1645,0,2025-08-20T07:18:54Z,TypeScript,MIT License,79042,main,"slides, presentation, vite, vueuse, vue, markdown",1218,800
MoneyPrinterTurbo,harry0703,https://github.com/harry0703/MoneyPrinterTurbo,39566,5730,0,2025-06-11T06:34:54Z,Python,MIT License,531961,main,"shortvideo, automation, chatgpt, moviepy, python, tiktok, ai",574,172
winutil,ChrisTitusTech,https://github.com/ChrisTitusTech/winutil,39550,2122,0,2025-08-30T15:31:00Z,PowerShell,MIT License,10438,main,,1909,1279
bert,google-research,https://github.com/google-research/bert,39471,9701,0,2024-07-23T23:39:41Z,Python,Apache License 2.0,317,master,"nlp, google, natural-language-processing, natural-language-understanding, tensorflow",1145,211
wrk,wg,https://github.com/wg/wrk,39428,3015,0,2023-12-30T10:33:51Z,C,Other,38743,master,,406,132
fd,sharkdp,https://github.com/sharkdp/fd,39412,917,0,2025-08-26T08:29:42Z,Rust,Apache License 2.0,2082,master,"command-line, tool, filesystem, search, regex, rust, cli, terminal, hacktoberfest",918,792
zju-icicles,QSCTech,https://github.com/QSCTech/zju-icicles,39410,9558,0,2025-06-23T16:45:51Z,HTML,No license,5536847,master,,78,263
php-src,php,https://github.com/php/php-src,39403,7936,0,2025-08-30T22:32:43Z,C,Other,606516,master,,4357,15077
upscayl,upscayl,https://github.com/upscayl/upscayl,39360,1821,0,2025-08-30T06:41:22Z,TypeScript,GNU Affero General Public License v3.0,567434,main,"ai, esrgan, image, upscale, electron, gigapixel, gigapixel-images, image-upscaling, topaz, upscalerimage, upscayl",954,134
esbuild,evanw,https://github.com/evanw/esbuild,39266,1233,0,2025-08-25T21:15:30Z,Go,MIT License,20151,main,"typescript, minifier, javascript, commonjs, compiler, jsx, tsx, css, react, bundler, esm",3763,463
Deep-Learning-Papers-Reading-Roadmap,floodsung,https://github.com/floodsung/Deep-Learning-Papers-Reading-Roadmap,39248,7345,0,2022-11-27T13:18:32Z,Python,No license,3638,master,deep-learning,57,93
English-level-up-tips,byoungd,https://github.com/byoungd/English-level-up-tips,39230,4228,0,2024-07-13T17:58:27Z,HTML,No license,151284,master,"chinese, tutorial, english-learning",101,38
video.js,videojs,https://github.com/videojs/video.js,39075,7514,0,2025-08-01T12:24:02Z,JavaScript,Other,128184,main,"video, player, hls, javascript, videojs, html, html5-video, html5-audio, html5, dash, video-player",5385,3235
FastChat,lm-sys,https://github.com/lm-sys/FastChat,39046,4742,0,2025-06-02T15:22:03Z,Python,Apache License 2.0,35345,main,,1900,1214
mem0,mem0ai,https://github.com/mem0ai/mem0,39045,4074,0,2025-08-30T16:28:30Z,Python,Apache License 2.0,41653,main,"ai, chatgpt, llm, python, chatbots, rag, application, long-term-memory, memory, memory-management, state-management, ai-agents, agents, genai",1109,2130
pandoc,jgm,https://github.com/jgm/pandoc,38994,3608,0,2025-08-30T11:00:04Z,Haskell,Other,68692,main,"pandoc, haskell, markdown, markup, converter, publishing, document, presentation, commonmark",7995,2190
materialize,Dogfalo,https://github.com/Dogfalo/materialize,38972,4697,0,2025-08-10T02:17:57Z,JavaScript,MIT License,165461,v1-dev,"design, css, framework, javascript, material-design, material, css-framework",5222,1445
tidb,pingcap,https://github.com/pingcap/tidb,38956,6006,0,2025-08-29T10:32:04Z,Go,Apache License 2.0,566714,master,"distributed-database, distributed-transactions, tidb, database, scale, mysql, htap, sql, cloud-native, serverless, mysql-compatibility, go, hacktoberfest",21341,41784
vim,vim,https://github.com/vim/vim,38860,5794,0,2025-08-29T16:32:57Z,Vim Script,Vim License,176790,master,"vim, c, text-editor, cross-platform",8951,8991
gorm,go-gorm,https://github.com/go-gorm/gorm,38782,4092,0,2025-08-28T06:10:16Z,Go,MIT License,4656,master,"go, golang, orm, web, gorm",6006,1430
tmux,tmux,https://github.com/tmux/tmux,38743,2255,0,2025-08-26T09:01:56Z,C,Other,17893,master,,3726,749
chatgpt-on-wechat,zhayujie,https://github.com/zhayujie/chatgpt-on-wechat,38721,9398,0,2025-08-08T02:47:49Z,Python,MIT License,4459,master,"chatgpt, wechat, openai, python3, feishu-bot, linkai, ai, gpt-4, llm, qwen, rag, wechat-bot, gemini, dingtalk, kimi, ai-agent, claude-4, deepseek, multi-agent, mcp",2002,470
ray,ray-project,https://github.com/ray-project/ray,38715,6749,0,2025-08-31T00:46:29Z,Python,Apache License 2.0,588429,master,"ray, distributed, parallel, machine-learning, reinforcement-learning, deep-learning, python, rllib, hyperparameter-search, optimization, data-science, hyperparameter-optimization, serving, deployment, pytorch, tensorflow, llm-serving, large-language-models, llm, llm-inference",21002,34767
remote-jobs,remoteintech,https://github.com/remoteintech/remote-jobs,38707,3753,0,2025-08-26T20:56:39Z,JavaScript,Creative Commons Zero v1.0 Universal,4478,main,"remote, jobsearch, jobs-search, remote-work, remote-job, jobseeker, hacktoberfest, distributed-companies, remote-companies",190,1719
curl,curl,https://github.com/curl/curl,38685,6840,0,2025-08-30T20:29:09Z,C,Other,112571,master,"http, https, ftp, user-agent, client, library, curl, libcurl, c, transfer-data, ldap, mqtt, sftp, scp, imaps, gopher, pop3, transferring-data, hacktoberfest, websocket",5165,12263
aria2,aria2,https://github.com/aria2/aria2,38600,3742,0,2025-08-18T08:51:00Z,C++,GNU General Public License v2.0,31506,master,"cpp11, http, ftp, sftp, bittorrent, rpc, download, metalink",1891,374
RSSHub,DIYgod,https://github.com/DIYgod/RSSHub,38524,8478,0,2025-08-30T22:01:17Z,TypeScript,MIT License,723475,master,"rss, twitter, weibo, bilibili, wechat, zhihu, pixiv, dribbble, instagram, youtube, douban, v2ex, telegram, spotify, tiktok, lofter, rsshub, ximalaya",6105,13550
styleguide,google,https://github.com/google/styleguide,38471,13002,0,2025-07-31T22:16:21Z,HTML,Other,3170,gh-pages,"cpplint, styleguide, style-guide",355,486
daisyui,saadeghi,https://github.com/saadeghi/daisyui,38466,1527,0,2025-08-30T19:29:56Z,Svelte,MIT License,10915695,master,"tailwind-css, ui-library, design-system, ui-pattern, ui-framework, css-components, css-framework, ui-kit, ui-design, design-pattern, design-systems, tailwind, css, postcss, tailwindcss, component, components, component-library, daisyui, svelte",1974,564
plane,makeplane,https://github.com/makeplane/plane,38448,2642,0,2025-08-30T17:30:13Z,TypeScript,GNU Affero General Public License v3.0,172430,preview,"django, docker, kanban, nextjs, project-management, python, react, typescript, jira, jira-alternative, linear, postgresql, redis, rest-api, issue-tracker, product-management, work-management",1320,6178
bark,suno-ai,https://github.com/suno-ai/bark,38429,4604,0,2024-08-19T07:45:36Z,Jupyter Notebook,MIT License,2641,main,,470,79
quivr,QuivrHQ,https://github.com/QuivrHQ/quivr,38361,3670,0,2025-07-09T12:55:23Z,Python,Other,130685,main,"ai, llm, api, chatbot, chatgpt, database, docker, frontend, openai, postgresql, privacy, security, typescript, html, javascript, react, rag, vector, groq, framework",1535,2053
Files,files-community,https://github.com/files-community/Files,38356,2402,0,2025-08-29T04:47:45Z,C#,MIT License,262484,main,"fluent-design, xaml, file-manager, winui, files, windows, csharp, windows-10, windows-11, fluent, good-first-issue, dotnet, developer-tools, utilities, alternatives, productivity, power-user, winappsdk, customization, git",10615,6316
trpc,trpc,https://github.com/trpc/trpc,38347,1403,0,2025-08-26T22:50:44Z,TypeScript,MIT License,53403,main,"typescript, api, nextjs, prisma, next, react",1286,4663
logseq,logseq,https://github.com/logseq/logseq,38319,2284,0,2025-08-30T14:29:39Z,Clojure,GNU Affero General Public License v3.0,142803,master,"knowledge-base, graph, clojurescript, clojure, org-mode, markdown, git, local-first, knowledge-graph, note-taking, pkm",7926,3500
phaser,phaserjs,https://github.com/phaserjs/phaser,38315,7121,0,2025-08-22T15:37:44Z,JavaScript,MIT License,458069,master,"phaser, phaserjs, javascript, html5-game-development, webgl, game-frameworks, game-development, gamedev, canvas, phaser-development, facebook-instant-games, discord-activities, youtube-playables",4554,2450
photoprism,photoprism,https://github.com/photoprism/photoprism,38242,2131,0,2025-08-29T08:05:38Z,Go,Other,296386,develop,"golang, tensorflow, photography, private-cloud, google-photos, ai, machine-learning, self-hosted",2385,997
windows,dockur,https://github.com/dockur/windows,38149,2857,0,2025-08-27T19:11:40Z,Shell,MIT License,1042,master,"docker, docker-container, windows, windows-virtual-machines, windows-virtual-desktop, windows-virtual-machine, windows-vm, virtualization",841,484
free,freefq,https://github.com/freefq/free,38126,5701,0,2024-08-20T09:43:55Z,Not specified,No license,42112,master,"fanqiang, v2ray, lantern, trojan, freefq, gfw, vmess, bulink, vpn, shadowsocks",749,16
MPAndroidChart,PhilJay,https://github.com/PhilJay/MPAndroidChart,38104,9052,0,2025-06-05T07:06:39Z,Java,Other,21593,master,"java, chart, graph, android, mpandroidchart",4964,511
