Repository,Owner,URL,Stars,Forks,Watchers,Last Commit Date,Main Language,License,Size (KB),Main Branch,Topics,Issues,Pull Requests
fastify,fastify,https://github.com/fastify/fastify,34446,2473,0,2025-08-28T06:01:42Z,JavaScript,Other,9280,main,"webframework, performance, speed, nodejs",2094,3785
RevokeMsgPatcher,huiyadanli,https://github.com/huiyadanli/RevokeMsgPatcher,34411,3764,0,2025-08-24T03:35:32Z,C#,GNU General Public License v3.0,3739,master,"patch, pc, windows, tool, wechat, qq, tim, revoke, hex-editor, revokemsg",902,15
TaskMatrix,chenfei-wu,https://github.com/chenfei-wu/TaskMatrix,34402,3280,0,2024-01-06T02:41:20Z,Python,Other,41169,main,,357,113
netty,netty,https://github.com/netty/netty,34389,16143,0,2025-08-30T09:57:31Z,Java,Apache License 2.0,101271,4.2,,6718,8613
manim,ManimCommunity,https://github.com/ManimCommunity/manim,34382,2414,0,2025-08-25T17:06:09Z,Python,MIT License,44758,main,"math, python, manim, animations, hacktoberfest",1684,2466
node-v0.x-archive,nodejs,https://github.com/nodejs/node-v0.x-archive,34378,7288,0,2024-08-15T20:32:32Z,Not specified,No license,144238,moved,,6379,3796
jieba,fxsjy,https://github.com/fxsjy/jieba,34358,6732,0,2024-08-21T09:23:45Z,Python,MIT License,56033,master,,866,167
LLM101n,karpathy,https://github.com/karpathy/LLM101n,34294,1854,0,2024-08-01T01:20:33Z,Not specified,No license,275,master,,0,14
formik,jaredpalmer,https://github.com/jaredpalmer/formik,34291,2795,0,2024-10-18T03:18:36Z,TypeScript,Apache License 2.0,15829,main,"react, forms, form, hooks, formik, react-hooks, render-props, higher-order-component, react-native",2260,1349
portainer,portainer,https://github.com/portainer/portainer,34275,2653,0,2025-08-27T13:13:01Z,TypeScript,zlib License,82788,develop,"docker, docker-swarm, ui, docker-deployment, docker-compose, docker-container, docker-image, portainer, docker-ui, dockerfile, moby, hacktoberfest, kubernetes",5900,5540
gold-miner,xitu,https://github.com/xitu/gold-miner,34253,5047,0,2024-04-17T09:44:37Z,Not specified,No license,80499,master,"android, translation, ios, frontend, react, tutorials, ai, swift, tensorflow, javascript",5601,3933
OpenVoice,myshell-ai,https://github.com/myshell-ai/OpenVoice,34244,3720,0,2025-04-19T16:00:00Z,Python,MIT License,3944,main,"text-to-speech, tts, voice-clone, zero-shot-tts",319,62
HowToLiveLonger,geekan,https://github.com/geekan/HowToLiveLonger,34231,2351,0,2025-05-19T14:10:41Z,Not specified,The Unlicense,71,main,"programmer, livelonger",138,27
llvm-project,llvm,https://github.com/llvm/llvm-project,34215,14876,0,2025-08-31T01:05:14Z,LLVM,Other,2736481,main,,86753,68608
clipboard.js,zenorocha,https://github.com/zenorocha/clipboard.js,34157,3950,0,2025-08-06T18:47:39Z,JavaScript,MIT License,3006,master,"clipboard, javascript",629,231
solid,solidjs,https://github.com/solidjs/solid,34150,984,0,2025-08-13T17:14:50Z,TypeScript,MIT License,14044,main,"javascript, performance, solid, proxies, declarative, fine-grained, jsx, reactive",1097,497
anoma,anoma,https://github.com/anoma/anoma,34083,4028,0,2025-08-14T14:27:56Z,Elixir,MIT License,77954,base,"cryptography, blockchain, protocol, consensus, distributed-systems, p2p, elixir, erlang, operating-system",699,1278
linux-command,jaywcjlove,https://github.com/jaywcjlove/linux-command,34070,6442,0,2025-08-29T04:12:19Z,Markdown,MIT License,3688446,master,"linux, linux-command, search, screen, screenshot, ls, ssh, bash, gh-pages, command-line, chrome, chrome-extension, tools, web-tools",207,447
husky,typicode,https://github.com/typicode/husky,34057,1071,0,2024-11-26T00:20:16Z,JavaScript,MIT License,4438,main,"git, hooks, commit, pre-commit",1089,459
12306,testerSunshine,https://github.com/testerSunshine/12306,34047,9739,0,2023-04-02T03:19:43Z,Python,MIT License,58570,master,,691,146
react-beautiful-dnd,atlassian,https://github.com/atlassian/react-beautiful-dnd,34036,2728,0,2025-08-18T04:35:31Z,JavaScript,Other,14804,master,"react, drag-and-drop, drag, dnd, sortable, reordering",1617,977
framework,laravel,https://github.com/laravel/framework,34022,11519,0,2025-08-30T20:11:02Z,PHP,MIT License,91971,12.x,"php, framework, laravel",18887,33220
poetry,python-poetry,https://github.com/python-poetry/poetry,33883,2371,0,2025-08-30T05:27:53Z,Python,MIT License,23450,main,"python, dependency-manager, package-manager, packaging, poetry",6236,3185
spring-boot-demo,xkcoding,https://github.com/xkcoding/spring-boot-demo,33865,10988,0,2024-07-24T02:02:52Z,Java,MIT License,14194,master,"java, in-action, demo, web, spring, spring-boot, spring-boot-2, spring-boot-demo, xkcoding",173,93
Python,geekcomputers,https://github.com/geekcomputers/Python,33818,12709,0,2025-08-28T00:20:39Z,Python,MIT License,44146,master,,492,2340
zsh-autosuggestions,zsh-users,https://github.com/zsh-users/zsh-autosuggestions,33708,1911,0,2025-06-24T16:15:03Z,Shell,MIT License,583,master,"shell, autosuggest, zsh, zsh-autosuggestions, fish, autocomplete",612,221
awesome-deepseek-integration,deepseek-ai,https://github.com/deepseek-ai/awesome-deepseek-integration,33678,3743,0,2025-05-13T09:05:21Z,Not specified,Creative Commons Zero v1.0 Universal,74537,main,,128,353
LeetCode-Go,halfrost,https://github.com/halfrost/LeetCode-Go,33659,5772,0,2024-12-11T05:55:51Z,Go,MIT License,19315,master,"leetcode, golang, go, leetcode-golang, leetcode-solutions, algorithms, algorithm, interview-questions, dynamic-programming, facebook, math, leetcode-go, algorithms-and-data-structures, algo, algorithm-competitions, acm-icpc, pattern",80,206
shadowsocks,shadowsocks,https://github.com/shadowsocks/shadowsocks,33656,18407,0,2024-04-01T09:07:32Z,Python,No license,891,rm,,0,164
AndroidUtilCode,Blankj,https://github.com/Blankj/AndroidUtilCode,33627,10709,0,2024-08-15T10:38:10Z,Java,Apache License 2.0,47329,master,"android, app, bar, cache, encode, encrypt, file, fragment, log, network, permission, regex, snackbar, spannable-string, toast, utils, thread-pool, reflect, androidx, eventbus",1589,220
easyexcel,alibaba,https://github.com/alibaba/easyexcel,33599,7645,0,2024-10-29T06:07:07Z,Java,Apache License 2.0,26334,master,"excel, poi, jxl, xls, xlsx, java, oom",3620,461
JavaScript,TheAlgorithms,https://github.com/TheAlgorithms/JavaScript,33565,5721,0,2025-01-22T07:00:31Z,JavaScript,GNU General Public License v3.0,3005,master,"algorithm, algorithm-challenges, data-structures, cryptography, cipher, search, sort, sorting-algorithms, mathematics, conversions, hacktoberfest, javascript, algorithms-implemented, algorithms",209,1548
zxing,zxing,https://github.com/zxing/zxing,33555,9419,0,2025-08-26T13:42:55Z,Java,Apache License 2.0,242789,master,"java, android, barcode, barcode-scanner, zxing, qr-code, datamatrix, upc",1326,536
AFNetworking,AFNetworking,https://github.com/AFNetworking/AFNetworking,33546,10493,0,2023-01-17T19:30:05Z,Objective-C,MIT License,6129,master,,0,1516
ShareX,ShareX,https://github.com/ShareX/ShareX,33537,3449,0,2025-08-30T20:24:48Z,C#,GNU General Public License v3.0,63453,develop,"screen-capture, screen-recorder, file-sharing, file-upload, url-shortener, color-picker, region-capture, imgur, dropbox, gif, gif-recorder, ocr, productivity, image-annotation, ftp, share, screenshot, sharex, capture, csharp",6904,1134
aseprite,aseprite,https://github.com/aseprite/aseprite,33534,7324,0,2025-08-28T16:53:30Z,C++,No license,44175,main,"animation, pixel-art, graphics, animated-sprites, spritesheet, gif, aseprite, c-plus-plus, sprites, draw, pixel-editor, tile-editor, tilemap-editor, sprite-editor, cpp",4306,999
awesome-docker,veggiemonk,https://github.com/veggiemonk/awesome-docker,33509,3133,0,2025-08-26T22:37:56Z,Not specified,Apache License 2.0,14392,master,"docker, awesome, awesome-list, container, tools, dockerfile, list, moby, docker-container, docker-image, docker-environment, docker-deployment, docker-swarm, docker-api, docker-monitoring, docker-machine, docker-security, docker-registry",130,1030
mattermost,mattermost,https://github.com/mattermost/mattermost,33508,7945,0,2025-08-30T17:49:32Z,TypeScript,Other,861958,master,"collaboration, mattermost, golang, react-native, hacktoberfest, monorepo, react",9054,22609
stats,exelban,https://github.com/exelban/stats,33441,1063,0,2025-08-30T20:28:10Z,Swift,MIT License,58130,master,"macos, monitor, cpu, gpu, disk, network, temperature, stats, battery, fans, sensors, bluetooth, menubar, clock",2190,480
How-To-Ask-Questions-The-Smart-Way,ryanhanwu,https://github.com/ryanhanwu/How-To-Ask-Questions-The-Smart-Way,33416,5728,0,2025-01-01T19:14:38Z,JavaScript,MIT License,380,main,"rtfm, translation, stfw",29,109
nps,ehang-io,https://github.com/ehang-io/nps,33342,5996,0,2024-05-30T03:51:08Z,Go,GNU General Public License v3.0,9168,master,"socks, tcp, gzip, udp, snnapy, go, nat, firewall, tunnel, ssh, dns, http, https, socks5, nps",1200,109
gpt-pilot,Pythagora-io,https://github.com/Pythagora-io/gpt-pilot,33327,3411,0,2025-03-04T06:26:32Z,Python,Other,47313,main,"ai, codegen, developer-tools, gpt-4, coding-assistant, research-project",550,497
jax,jax-ml,https://github.com/jax-ml/jax,33312,3146,0,2025-08-30T16:44:21Z,Python,Apache License 2.0,133524,main,jax,6489,21694
XX-Net,XX-net,https://github.com/XX-net/XX-Net,33305,7627,0,2025-08-26T00:53:05Z,Python,No license,60574,master,"goagent, gfw, proxy, vpn, uncensored",13325,486
awesome-cursorrules,PatrickJS,https://github.com/PatrickJS/awesome-cursorrules,33250,2769,0,2025-08-24T15:18:06Z,MDX,Creative Commons Zero v1.0 Universal,1895,main,"awesome, awesome-list, cursor, cursor-ai-editor, cursorrules",42,88
Fabric,danielmiessler,https://github.com/danielmiessler/Fabric,33240,3404,0,2025-08-28T19:40:58Z,JavaScript,MIT License,215895,main,"ai, augmentation, flourishing, life, work",744,631
lossless-cut,mifi,https://github.com/mifi/lossless-cut,33204,1561,0,2025-08-30T22:35:50Z,TypeScript,GNU General Public License v2.0,22444,master,"video, editor, ffmpeg, video-files, cut, codec, player, lossless, video-editor, losslesscut",1635,269
carbon-lang,carbon-language,https://github.com/carbon-language/carbon-lang,33178,1510,0,2025-08-30T02:35:07Z,C++,Other,69070,trunk,"programming-language, carbon-lang, compiler, cpp, language, experimental, experimental-language",716,4913
harness,harness,https://github.com/harness/harness,33160,2858,0,2025-08-29T11:38:09Z,Go,Apache License 2.0,55165,main,"continuous-delivery, continuous-integration, go, build-pipelines, build-automation, docker, ci, ci-cd, hacktoberfest, git, scm, code-repository",2007,1532
brackets,adobe,https://github.com/adobe/brackets,33158,7577,0,2022-06-12T08:19:24Z,JavaScript,MIT License,92974,master,,9680,5601
Folo,RSSNext,https://github.com/RSSNext/Folo,33120,1545,0,2025-08-30T18:55:03Z,TypeScript,GNU General Public License v3.0,58772,dev,"reader, rss, rss-reader, ai, blockchain",2273,1445
selenium,SeleniumHQ,https://github.com/SeleniumHQ/selenium,33068,8570,0,2025-08-30T00:37:12Z,Java,Apache License 2.0,2351625,trunk,"selenium, webdriver, java, ruby, python, javascript, dotnet, rust",10947,5166
immutable-js,immutable-js,https://github.com/immutable-js/immutable-js,33066,1779,0,2025-08-20T14:22:48Z,TypeScript,MIT License,126499,main,,1262,869
gulp,gulpjs,https://github.com/gulpjs/gulp,33063,4209,0,2025-06-01T21:52:54Z,JavaScript,MIT License,1125,master,,1937,685
vault,hashicorp,https://github.com/hashicorp/vault,33028,4426,0,2025-08-29T20:10:17Z,Go,Other,332972,main,"vault, go, secrets",6387,24956
ruoyi-vue-pro,YunaiV,https://github.com/YunaiV/ruoyi-vue-pro,33018,7105,0,2025-08-28T02:30:51Z,Java,MIT License,182109,master,"springboot, vue, mysql, redis, mybatis-plus, redisson, spring-security, flowable",654,210
AnotherRedisDesktopManager,qishibo,https://github.com/qishibo/AnotherRedisDesktopManager,33014,2672,0,2025-06-18T14:50:05Z,JavaScript,MIT License,5526,master,"redis-desktop-manager, redis-cluster, redis-gui, redis-client, redis",1067,227
ijkplayer,bilibili,https://github.com/bilibili/ijkplayer,33006,8214,0,2024-08-13T00:53:33Z,C,GNU General Public License v2.0,8283,master,"ijkplayer, android, ios, video, player, ffmpeg",5376,228
openpose,CMU-Perceptual-Computing-Lab,https://github.com/CMU-Perceptual-Computing-Lab/openpose,32970,8001,0,2024-08-03T01:59:11Z,C++,Other,86496,master,"openpose, computer-vision, machine-learning, cpp, caffe, opencv, human-pose-estimation, real-time, deep-learning, human-behavior-understanding, cvpr-2017, multi-person, foot-estimation, keypoints, face, pose, pose-estimation, human-pose, keypoint-detection, hand-estimation",2004,263
ControlNet,lllyasviel,https://github.com/lllyasviel/ControlNet,32965,2956,0,2024-02-25T09:49:39Z,Python,Apache License 2.0,125281,main,,569,44
pathway,pathwaycom,https://github.com/pathwaycom/pathway,32937,955,0,2025-08-30T08:46:47Z,Python,Other,138064,main,"batch-processing, kafka, pathway, python, streaming, machine-learning-algorithms, real-time, data-analytics, data-pipelines, data-processing, dataflow, etl, etl-framework, iot-analytics, rust, stream-processing, time-series-analysis",98,13
awesome-awesomeness,bayandin,https://github.com/bayandin/awesome-awesomeness,32831,3583,0,2024-06-02T22:46:41Z,Ruby,No license,381,master,,68,418
ShadowsocksX-NG,shadowsocks,https://github.com/shadowsocks/ShadowsocksX-NG,32829,7899,0,2024-10-29T12:19:30Z,Swift,GNU General Public License v3.0,50660,develop,"shadowsocks, swift, macos, shadowsocksx-ng, v2ray-plugin, kcptun",1359,119
Reactive-Resume,AmruthPillai,https://github.com/AmruthPillai/Reactive-Resume,32758,3475,0,2025-08-31T00:12:33Z,TypeScript,MIT License,109017,main,"resume, resume-builder, react, tailwindcss, nextjs, nestjs, material-ui, hacktoberfest",1572,782
C-Plus-Plus,TheAlgorithms,https://github.com/TheAlgorithms/C-Plus-Plus,32751,7490,0,2025-08-24T01:14:12Z,C++,MIT License,137306,master,"cpp, algorithm, algorithms-implemented, data-structures, algorithm-competitions, interview-preparation, interview-questions, search, sort, educational, instructor-materials, machine-learning-algorithms, artificial-intelligence-algorithms, computer-science, machine-learning, mathematics",322,2636
qBittorrent,qbittorrent,https://github.com/qbittorrent/qBittorrent,32741,4364,0,2025-08-29T12:51:31Z,C++,Other,278037,master,"c-plus-plus, bittorrent, torrent, crossplatform, bittorrent-client, torrent-client",16880,4928
libpku,lib-pku,https://github.com/lib-pku/libpku,32737,8300,0,2022-01-05T04:09:27Z,TeX,No license,714371,master,,43,34
detectron2,facebookresearch,https://github.com/facebookresearch/detectron2,32662,7766,0,2025-08-27T22:45:52Z,Python,Apache License 2.0,6514,main,,3557,715
swc,swc-project,https://github.com/swc-project/swc,32655,1335,0,2025-08-29T08:35:54Z,Rust,Apache License 2.0,407308,main,"ecmascript, compiler, rust, javascript, parser, babel, swc, ecmascript-parser, typescript, typescript-compiler, typescript-parser",3981,6337
bulletproof-react,alan2207,https://github.com/alan2207/bulletproof-react,32613,2952,0,2025-04-16T06:04:21Z,TypeScript,MIT License,2171,master,"react, react-applications, react-best-practice, react-typescript, react-architecture-patterns, react-guidelines, react-project-structure",115,116
data-engineering-zoomcamp,DataTalksClub,https://github.com/DataTalksClub/data-engineering-zoomcamp,32512,6902,0,2025-07-17T09:55:25Z,Jupyter Notebook,No license,8757,main,"data-engineering, kafka, spark, dbt, docker, kestra",136,600
agno,agno-agi,https://github.com/agno-agi/agno,32504,4131,0,2025-08-30T16:55:18Z,Python,Mozilla Public License 2.0,233686,main,"developer-tools, python, ai, agents, agi, framework",1287,2242
pnpm,pnpm,https://github.com/pnpm/pnpm,32503,1181,0,2025-08-30T23:52:54Z,TypeScript,MIT License,191249,main,"npm, dependency-manager, package-manager, node, nodejs, install, modules, javascript",4908,3687
jq,jqlang,https://github.com/jqlang/jq,32484,1660,0,2025-08-27T03:05:21Z,C,Other,7219,master,jq,2283,1061
it-tools,CorentinTh,https://github.com/CorentinTh/it-tools,32451,3973,0,2025-08-19T13:41:18Z,Vue,GNU General Public License v3.0,17113,main,"vuejs, tools, tool, converter, website, frontend, developer-tools, developer-productivity, productivity, javascript, typescript",620,920
drawdb,drawdb-io,https://github.com/drawdb-io/drawdb,32451,2386,0,2025-08-30T20:18:20Z,JavaScript,GNU Affero General Public License v3.0,5674,main,"database-schema, editor, mariadb, postgresql, sql, sql-server, sqlite, svg, react, indexeddb, tailwindcss, javascript, diagram-editor, erd, erdiagram, hacktoberfest, oracle-database",245,304
rufus,pbatard,https://github.com/pbatard/rufus,32446,2798,0,2025-08-25T20:31:30Z,C,GNU General Public License v3.0,42703,master,"usb, iso, bootable-drives, mbr, uefi, bios, boot, windows, syslinux, freedos, grub, grub4dos, sha1, sha256, md5, gpt, windows-to-go, persistence, secure-boot, rufus",2512,227
certbot,certbot,https://github.com/certbot/certbot,32423,3442,0,2025-08-29T21:39:48Z,Python,Other,64538,main,"acme, acme-client, certbot, certificate, letsencrypt, python",5468,4931
duckdb,duckdb,https://github.com/duckdb/duckdb,32418,2541,0,2025-08-30T13:00:07Z,C++,MIT License,366755,main,"sql, database, olap, analytics, embedded-database",6143,9272
refine,refinedev,https://github.com/refinedev/refine,32412,2688,0,2025-08-29T13:32:19Z,TypeScript,MIT License,7617187,main,"react, typescript, admin, admin-ui, ant-design, react-framework, frontend-framework, graphql, nestjs, nextjs, react-hooks, headless, javascript, low-code, crud, internal-tools, developer-tools, hacktoberfest, good-first-issue, open-source-project",1658,4961
spaCy,explosion,https://github.com/explosion/spaCy,32377,4572,0,2025-05-28T15:28:05Z,Python,MIT License,203297,master,"natural-language-processing, data-science, machine-learning, python, cython, nlp, artificial-intelligence, ai, spacy, nlp-library, neural-network, neural-networks, deep-learning, named-entity-recognition, entity-linking, text-classification, tokenization",5719,4065
cherry-studio,CherryHQ,https://github.com/CherryHQ/cherry-studio,32373,2882,0,2025-08-30T18:03:13Z,TypeScript,Other,85436,main,"openai, agent, anthropic, assistant, chatbot, electron, llm, chatbotai, mcp-client",6506,2551
Real-ESRGAN,xinntao,https://github.com/xinntao/Real-ESRGAN,32339,4035,0,2024-08-06T13:15:18Z,Python,"BSD 3-Clause ""New"" or ""Revised"" License",5514,master,"esrgan, pytorch, real-esrgan, super-resolution, image-restoration, denoise, jpeg-compression, amine",733,104
modern-unix,ibraheemdev,https://github.com/ibraheemdev/modern-unix,32321,810,0,2024-09-10T19:48:56Z,Not specified,No license,72,master,"lists, unix, shell, tools, command-line, terminal, cli",83,61
CyberChef,gchq,https://github.com/gchq/CyberChef,32314,3631,0,2025-08-06T08:54:32Z,JavaScript,Apache License 2.0,124268,master,"data-analysis, data-manipulation, encryption, encoding, compression, parsing, hashing",1062,834
learnGitBranching,pcottle,https://github.com/pcottle/learnGitBranching,32303,5873,0,2025-08-21T22:01:34Z,JavaScript,MIT License,51711,main,,516,702
tiptap,ueberdosis,https://github.com/ueberdosis/tiptap,32278,2647,0,2025-08-31T00:35:17Z,TypeScript,MIT License,60642,develop,"js, vue, wysiwyg, wysiwyg-editor, rich-text, editor, javascript, react, prosemirror, renderless-components, tiptap",3257,1745
material-design-lite,google,https://github.com/google/material-design-lite,32263,4974,0,2025-03-11T00:13:36Z,HTML,Apache License 2.0,56990,mdl-1.x,"material-design, material-design-lite, mdl, material-components, material",2194,1200
serenity,SerenityOS,https://github.com/SerenityOS/serenity,32259,3266,0,2025-08-30T01:25:59Z,C++,"BSD 2-Clause ""Simplified"" License",237919,master,"operating-system, c-plus-plus, os, unix, desktop-environment, kernel, browser",4251,21830
directus,directus,https://github.com/directus/directus,32225,4358,0,2025-08-30T15:45:26Z,TypeScript,Other,425637,main,"api, cms, graphql, app, database, vue, sqlite, mysql, postgresql, mssql, directus, node, headless-cms, no-code, typescript, javascript, data-visualization, sql, composable, mariadb",9375,9344
beego,beego,https://github.com/beego/beego,32223,5629,0,2025-08-21T13:09:19Z,Go,Other,11978,master,"go, beego",3374,2277
chatbot-ui,mckaywrigley,https://github.com/mckaywrigley/chatbot-ui,32188,9312,0,2024-08-03T00:38:07Z,TypeScript,MIT License,3644,main,,993,772
my-tv,lizongying,https://github.com/lizongying/my-tv,32146,3601,0,2024-06-20T06:21:11Z,C,No license,72954,main,"mytv, tv, my-tv, iptv",919,22
run,The-Run-Philosophy-Organization,https://github.com/The-Run-Philosophy-Organization/run,32110,2606,0,2024-07-31T03:44:51Z,Not specified,Creative Commons Attribution Share Alike 4.0 International,411061,main,,256,218
claude-code,anthropics,https://github.com/anthropics/claude-code,32042,1926,0,2025-08-29T21:24:21Z,TypeScript,No license,15798,main,,6702,116
etcher,balena-io,https://github.com/balena-io/etcher,32024,2265,0,2025-07-29T12:17:38Z,TypeScript,Apache License 2.0,100989,master,"etcher, sd-cards, cross-platform, usb-drives",2382,2095
tabby,TabbyML,https://github.com/TabbyML/tabby,32015,1574,0,2025-08-26T20:03:41Z,Rust,Other,111863,main,"ai, codegen, coding-assistant, coding-language, developer-experience, developer-tools, gen-ai, llms, ide",944,3262
nacos,alibaba,https://github.com/alibaba/nacos,32002,13135,0,2025-08-28T05:53:30Z,Java,Apache License 2.0,65200,develop,"nacos, dubbo, alibaba, kubernetes, istio, spring-cloud, microservices, service-mesh, configuration-management, distributed-configuration, dns, service-discovery, config, ai-registry, mcp, mcp-registry, a2a-registry, mcp-management",9166,4420
GPT_API_free,chatanywhere,https://github.com/chatanywhere/GPT_API_free,31995,2295,0,2025-08-27T18:15:58Z,Python,MIT License,5567,main,"api, chatgpt, claude, deepseek, gemini, gpt, grok",379,7
vnpy,vnpy,https://github.com/vnpy/vnpy,31971,10039,0,2025-08-29T01:16:15Z,Python,MIT License,274298,master,"trading, investment, quant, python, algotrading, finance, fintech, vnpy",2128,1523
chatgpt-web,Chanzhaoyu,https://github.com/Chanzhaoyu/chatgpt-web,31942,11132,0,2024-08-16T15:26:57Z,Vue,MIT License,6223,main,,1747,338
yew,yewstack,https://github.com/yewstack/yew,31912,1446,0,2025-08-27T15:29:35Z,Rust,Apache License 2.0,17989,master,"rust, web, gui, jsx, elm, web-framework, wasm, asmjs, emscripten, concurrency, multithreading, webworkers, hacktoberfest",1259,2317
v2ray-core,v2fly,https://github.com/v2fly/v2ray-core,31887,4874,0,2025-08-30T00:52:53Z,Go,MIT License,68708,master,"proxy, network, socks5, shadowsocks, v2ray, vmess, vless, v2fly, anticensorship, vpn, trojan, tunnel, hacktoberfest",1042,1372
mpv,mpv-player,https://github.com/mpv-player/mpv,31873,3109,0,2025-08-29T17:08:29Z,C,Other,110449,master,"mpv, mplayer, c, ffmpeg, audio, video, multimedia, hacktoberfest",10565,5442
swr,vercel,https://github.com/vercel/swr,31872,1276,0,2025-08-11T15:20:44Z,TypeScript,MIT License,3522,main,"react, hook, data-fetching, swr, suspense, react-native, fetch, vercel, stale-while-revalidate, hooks, nextjs, data, cache",959,975
awesome-php,ziadoz,https://github.com/ziadoz/awesome-php,31853,5127,0,2025-05-12T08:36:08Z,Not specified,Do What The F*ck You Want To Public License,1520,master,"php, php-framework, php-library, php-applications, php-installation, awesome-lists, awesome",153,1169
WxJava,binarywang,https://github.com/binarywang/WxJava,31824,8963,0,2025-08-08T10:25:32Z,Java,Apache License 2.0,18509,develop,"weixin, wechat, weixin-sdk, wechat-sdk, java, sdk, cp, mp, wxpay, wxjava, miniapp, miniprogram, open, weapp, hacktoberfest",2373,1291
android-open-project,Trinea,https://github.com/Trinea/android-open-project,31797,11903,0,2025-08-02T15:31:51Z,Not specified,Apache License 2.0,2134,master,"android, open-source-project",86,311
Hello-Python,mouredev,https://github.com/mouredev/Hello-Python,31774,2031,0,2025-08-11T12:00:01Z,Python,Apache License 2.0,5715,main,"fastapi, mongodb, python, python3, tutorial, chatgpt, chatgpt-api, gpt-3, gpt-4, openai, openai-api, backend, frontend, reflex",295,13
shardeum,shardeum,https://github.com/shardeum/shardeum,31762,689,0,2025-08-30T05:25:48Z,TypeScript,MIT License,25648,dev,"blockchain, dapp, ethereum, evm, evm-blockchain, payments, sharding, typescript",38,515
fairseq,facebookresearch,https://github.com/facebookresearch/fairseq,31758,6597,0,2025-06-10T21:41:39Z,Python,MIT License,26077,main,"python, pytorch, artificial-intelligence",4247,1369
Retrieval-based-Voice-Conversion-WebUI,RVC-Project,https://github.com/RVC-Project/Retrieval-based-Voice-Conversion-WebUI,31734,4454,0,2024-11-24T15:09:44Z,Python,MIT License,14585,main,"change, sovits, vits, voice, voice-conversion, rvc, audio-analysis, conversational-ai, conversion, converter, retrieval-model, retrieve-data, so-vits-svc, vc, voice-converter, voiceconversion",1923,709
go-zero,zeromicro,https://github.com/zeromicro/go-zero,31705,4194,0,2025-08-28T19:06:44Z,Go,MIT License,32369,master,"golang, microservice, rpc-framework, web-framework, gozero, rpc, restful-api, code-generation, go-zero, goctl, microservices, go, restful, cloud-native, microservice-framework, microservices-architecture, rest-api, framework, gateway, grpc-gateway",1875,3169
floating-ui,floating-ui,https://github.com/floating-ui/floating-ui,31685,1646,0,2025-08-21T06:33:46Z,TypeScript,MIT License,41080,master,"positioning-engine, tooltip, position, dropdown, popover, positioning, tooltip-position, popovers, hacktoberfest",1457,1425
graphql-engine,hasura,https://github.com/hasura/graphql-engine,31673,2821,0,2025-08-27T07:53:14Z,TypeScript,Apache License 2.0,5193258,master,"graphql, graphql-server, postgres, hasura, access-control, automatic-api, api, rest-api, graphql-api, sql-server, bigquery, haskell, mongodb, subgraph, supergraph",6380,3405
pytorch-tutorial,yunjey,https://github.com/yunjey/pytorch-tutorial,31670,8243,0,2023-08-15T10:17:50Z,Python,MIT License,13110,master,"deep-learning, pytorch-tutorial, neural-networks, pytorch",180,73
